kharakteristik,pengguna perangkat mobilitas roda %,pengguna perangkat mobilitas beroda interval kepercayaan 95% dari,pengguna perangkat mobilitas beroda dengan interval kepercayaan 95%.,bukan pengguna alat mobilitas beroda %,non-pengguna perangkat mobilitas roda interval kepercayaan 95% dari,non-pengguna perangkat mobilitas beroda interval kepercayaan 95% hingga
keluarga dalam satu rumah tangga,65.3,63.3,67.3,65.6,64.6,66.0
keluarga yang tidak serumah,44.4,42.5,46.3,40.4,39.6,40.8
teman/tetangga,30.4,28.8,32.1,25.6,25.0,25.9
organisasi/individu berbayar,27.0,25.8,28.2,20.4,19.9,20.7
organisasi/individu yang tidak dibayar,35.4,33.5,37.4,11.0,10.5,11.5
