kharakteristik,pengguna non-medis saja (nmo) %,pengguna non-medis saja (nmo) interval kepercayaan 95% dari,pengguna non-medis saja (nmo) interval kepercayaan 95% hingga,pengguna medis / non-medis (sdmnm) yang ditentukan sendiri %,ditentukan sendiri oleh pengguna medis / non-medis (sdmnm) interval kepercayaan 95% dari,ditentukan sendiri oleh pengguna medis / non-medis (sdmnm) dengan interval kepercayaan 95% hingga
memiliki keinginan atau dorongan yang kuat untuk menggunakan ganja,14.1,10.6,18.6,22.8,16.1,31.2
"mengalami masalah kesehatan, sosial, hukum atau keuangan karena penggunaan ganja",3.4,2.0,5.7,,,
tidak dapat melakukan apa yang biasanya diharapkan dari mereka karena penggunaan ganja,4.2,2.6,6.8,,,
"menerima pernyataan keprihatinan tentang penggunaan ganja dari teman, keluarga, atau orang lain",4.0,2.7,5.7,,,
"mencoba mengendalikan, mengurangi atau berhenti menggunakan ganja tetapi ternyata mereka tidak mampu melakukannya",1.9,1.1,3.3,,,
