kharakteristik,rasio perempuan pekerja muda terhadap rasio pekerja tua,proporsi perempuan dari populasi pekerja berusia 55 tahun ke atas persen,rasio laki-laki antara pekerja muda dan rasio pekerja tua,proporsi laki-laki dari penduduk bekerja berusia 55 tahun ke atas persen
jumlah penduduk,1.03,20.3,0.92,22.7
total populasi identitas pribumi,1.41,16.0,1.37,16.7
total populasi identitas pribumi negara pertama,1.41,15.8,1.52,15.5
total populasi identitas asli bertemu,1.42,16.1,1.21,18.2
total populasi identitas asli inuit,1.78,13.5,1.84,13.7
total populasi identitas non-pribumi,1.02,20.5,0.91,22.9
