kharakteristik,wilayah pertanian 1 pekerja berbahasa perancis,wilayah pertanian 1 pekerja berbahasa inggris,wilayah pertanian 3 pekerja berbahasa Perancis,wilayah pertanian 3 pekerja berbahasa inggris,wilayah pertanian 4 pekerja berbahasa Perancis,wilayah pertanian 4 pekerja berbahasa inggris
persen tidak berfungsi pada tahun 2010,0.0,0.0,0.0,0.0,0.0,0.0
persen karyawan,86.1,81.1,73.1,49.0,84.1,81.3
persen pekerja keluarga yang tidak dibayar,0.0,1.1,0.0,4.5,2.6,0.0
"persen wiraswasta, berbadan hukum",7.0,4.3,22.4,7.6,5.6,0.0
"persen wiraswasta, bukan badan hukum",5.3,13.1,0.0,40.1,8.7,14.1
