kharakteristik,pekerja berbahasa Perancis di Ontario Timur,ontario timur pekerja lainnya,pekerja berbahasa Perancis di Ontario Utara,ontario utara pekerja lainnya
persen jenis kelamin,,,,
persen berjenis kelamin perempuan,49.0,50.6,59.7,59.2
persen berjenis kelamin laki-laki,51.0,49.4,40.4,40.7
persen status perkawinan,,,,
persen status perkawinan lajang,53.5,56.2,44.7,53.0
persen status perkawinan menikah,26.1,26.9,33.1,26.6
persen status perkawinan menurut hukum adat,12.6,10.1,12.6,12.6
"persen status perkawinan berpisah, bercerai, atau menjanda",7.8,6.8,9.6,7.8
